{
  "$schema": "http://json-schema.org/draft-07/schema#",
  "title": "Chapter Schema",
  "description": "Standardized data model for a chapter in Athena OS.",
  "type": "object",
  "properties": {
    "prose_content": { "type": "string", "minLength": 1, "description": "Complete chapter prose, not a summary." },
    "id": {
      "type": "string",
      "description": "Unique identifier for the chapter (e.g., CHAP-01)"
    },
    "title": {
      "type": "string",
      "description": "The title or primary focus of the chapter"
    },
    "objective": {
      "type": "string",
      "description": "The narrative structural goal (e.g., Inciting Incident, Establish B-Story)"
    },
    "summary": {
      "type": "string",
      "description": "A concise summary of the events that occur"
    },
    "cliffhanger": {
      "type": "string",
      "description": "The specific unanswered question, revelation, or tension hook at the end of the chapter"
    },
    "continuity_notes": {
      "type": "array",
      "items": { "type": "string" },
      "description": "Specific facts established in this chapter that must remain true globally (e.g., character injury, lost item)"
    }
  },
  "required": ["id", "title", "prose_content", "objective", "summary", "cliffhanger", "continuity_notes"]
}
