{
  "id": "CHAP-01",
  "title": "The Weight of Unearned Glory",
  "objective": "Establish Kaelen Varrus's moral baseline, revealing his capability while highlighting his deep internal dissatisfaction with the limits of conventional service.",
  "summary": "Kaelen attends a routine strategic briefing where he demonstrates professional competence and unwavering adherence to duty. However, through observation of the flawed planning and the casual dismissal of true potential by his peers, he solidifies an internal realization: his disciplined life is merely a gilded cage, feeding a deep, restless yearning for a destiny far grander than mere service allows.",
  "prose_content": "### Scene 1: The Boardroom's Limits\n\nThe scent in the command tent was a predictable blend of stale wool, oiled leather, and weak coffee—the institutional smell of competence. It clung to everything like dust, settling into the creases of uniforms and the grain of polished mahogany. Kaelen stood at the periphery of the map table, his posture impeccable, every line of his body trained by years of military discipline.\n\nThe current plan was laid out before them: a methodical push through the low passes, designed to secure supply lines and pacify the border settlements. It was safe—structurally sound, if utterly uninspired. The senior officers spoke in clipped tones about logistics and manpower quotas, their voices weaving together a tapestry of necessity. Kaelen listened, filtering the conversation not for information, but for flaws.\n\nHe tracked Major Elms’s hand as he pointed to a key river crossing on the map—a point everyone agreed was vital. The man spoke with the practiced assurance of someone whose ideas had never been challenged. Yet, when Kaelen looked at the contours of the land, he saw not an impenetrable bottleneck, but a deep, overlooked seasonal ford that would render Elms’s entire approach obsolete after the autumn rains.\n\nHe cleared his throat, the sound too loud in the sudden lull between remarks. The room shifted slightly, attention snagging on him like flies to a sweet spot of decay. He waited for the inevitable roll of eyes; they were already forming, faint and weary, behind the thick lenses of their spectacles. \n\n> “With all due respect, Major,” Kaelen began, his voice level, carrying the dry weight of fact rather than challenge, “the current assessment relies too heavily on the summer flow rate for the Wyrm’s Coil crossing.”\n\nThe room fell silent. Elms paused mid-gesture, his face settling into a mask of polite annoyance. \n\n> “The ford is reliable enough,” Elms dismissed, waving a dismissive hand that barely disturbed the air above the map.\n\nKaelen did not argue the point; he simply adjusted his weight from one foot to the other—a small, controlled movement that suggested deep thought rather than simple disagreement. He focused instead on the periphery of the tent: the way the afternoon light, filtered through a gap in the canvas roof, hit a loose thread near the supporting pole. It was an insignificant detail, yet it seemed to pull all his attention, anchoring him to the immediate physical reality.\n\nThe flaw wasn't the ford; the flaw was the assumption of permanence. The officers saw lines drawn on paper—solid borders that dictated action. But Kaelen had started noticing the gaps: the places where the map ended and the messy, chaotic reality began. The world, he realized, was not a blueprint; it was an ongoing failure to maintain structural integrity.\n\nHe didn't need the title of General; he needed the *understanding* that made Generals irrelevant. He felt a deep, unsettling ache beneath his ribs—the sensation of untapped potential, like a muscle kept deliberately atrophied by routine exercise. It was not mere ambition; it was the desperate yearning for recognition commensurate with the scope of his mind.\n\nAs they concluded the meeting and Kaelen watched the senior officers pack up their pens and notes, he felt the weight lift from him—the temporary relief of having executed his duty perfectly. But the feeling was immediately replaced by a profound emptiness. He had proven himself reliable, skilled, predictable. And in that predictability, the yearning solidified into something sharp and demanding. The service was not enough to fill the space where true significance should have been.",
  "cliffhanger": "Kaelen is left alone with the discarded maps, realizing that his disciplined life has created a profound vacuum of self-worth, hinting at the necessity of an outside force (the witches) to break his routine and fulfill his need for 'destiny.'",
  "continuity_notes": [
    "Kaelen Varrus is highly competent but feels undervalued by established military authority.",
    "His internal conflict centers on the gap between his disciplined life/duty and his profound desire for recognized, ultimate significance (destiny)."
  ]
}